{
  "published_at": "2026-10-14T12:52:58Z",
  "score": 61.0,
  "coverage_pct": 100.0,
  "indicators": [
    {
      "code": "DRCCLACBS",
      "weight": 20,
      "direction": 1,
      "value": 2.85,
      "as_of": "2026-04-01",
      "score": 63.3
    },
    {
      "code": "TERMCBCCALLNS",
      "weight": 15,
      "direction": 1,
      "value": 21.19,
      "as_of": "2026-08-01",
      "score": 77.4
    },
    {
      "code": "PSAVERT",
      "weight": 15,
      "direction": -1,
      "value": 4.1,
      "as_of": "2026-08-01",
      "score": 89.1
    },
    {
      "code": "TDSP",
      "weight": 15,
      "direction": 1,
      "value": 11.111439,
      "as_of": "2026-04-01",
      "score": 63.3
    },
    {
      "code": "REVOLSL",
      "weight": 15,
      "direction": 1,
      "transform": "yoy",
      "value": 3.37,
      "as_of": "2026-08-01",
      "score": 41.3
    },
    {
      "code": "DRSFRMACBS",
      "weight": 10,
      "direction": 1,
      "value": 1.86,
      "as_of": "2026-04-01",
      "score": 50.0
    },
    {
      "code": "CCSA",
      "weight": 10,
      "direction": 1,
      "value": 1716000.0,
      "as_of": "2026-09-26",
      "score": 27.0
    }
  ],
  "history": {
    "dates": [
      "2021-10-31",
      "2021-11-30",
      "2021-12-31",
      "2022-01-31",
      "2022-02-28",
      "2022-03-31",
      "2022-04-30",
      "2022-05-31",
      "2022-06-30",
      "2022-07-31",
      "2022-08-31",
      "2022-09-30",
      "2022-10-31",
      "2022-11-30",
      "2022-12-31",
      "2023-01-31",
      "2023-02-28",
      "2023-03-31",
      "2023-04-30",
      "2023-05-31",
      "2023-06-30",
      "2023-07-31",
      "2023-08-31",
      "2023-09-30",
      "2023-10-31",
      "2023-11-30",
      "2023-12-31",
      "2024-01-31",
      "2024-02-29",
      "2024-03-31",
      "2024-04-30",
      "2024-05-31",
      "2024-06-30",
      "2024-07-31",
      "2024-08-31",
      "2024-09-30",
      "2024-10-31",
      "2024-11-30",
      "2024-12-31",
      "2025-01-31",
      "2025-02-28",
      "2025-03-31",
      "2025-04-30",
      "2025-05-31",
      "2025-06-30",
      "2025-07-31",
      "2025-08-31",
      "2025-09-30",
      "2025-10-31",
      "2025-11-30",
      "2025-12-31",
      "2026-01-31",
      "2026-02-28",
      "2026-03-31",
      "2026-04-30",
      "2026-05-31",
      "2026-06-30",
      "2026-07-31",
      "2026-08-31",
      "2026-09-26"
    ],
    "score": [
      44.8,
      44.6,
      43.6,
      49.2,
      51.0,
      50.5,
      51.8,
      61.9,
      61.9,
      63.7,
      64.1,
      63.4,
      67.0,
      67.3,
      66.8,
      65.6,
      64.9,
      64.4,
      71.0,
      70.4,
      71.1,
      73.3,
      73.2,
      74.3,
      72.7,
      71.9,
      69.2,
      68.2,
      68.7,
      70.4,
      69.7,
      70.1,
      70.5,
      73.3,
      73.2,
      74.9,
      72.6,
      67.2,
      66.5,
      65.0,
      63.8,
      62.6,
      62.1,
      62.8,
      64.1,
      65.1,
      65.3,
      65.7,
      66.2,
      64.7,
      66.1,
      62.2,
      62.3,
      62.3,
      61.2,
      60.3,
      62.4,
      60.1,
      61.5,
      61.0
    ]
  }
}
